{
  "report_id": "corr-session-01",
  "generated_at": "2026-03-13T13:00:00Z",
  "session": {
    "session_id": "session-01",
    "user_id": "user-01",
    "status": "open",
    "created_at": "2026-03-13T12:58:00Z",
    "last_resumed_at": null,
    "metadata": {
      "initial_intent": "Summarize the current plan locally"
    }
  },
  "summary": {
    "task_count": 2,
    "audit_entry_count": 3,
    "runtime_event_count": 3,
    "remote_audit_count": 0,
    "observability_record_count": 3,
    "working_memory_count": 1,
    "episodic_entry_count": 1,
    "task_states": [
      "approved",
      "planned"
    ],
    "audit_decisions": [
      "allowed",
      "approval-pending",
      "approval-approved"
    ],
    "runtime_event_kinds": [
      "runtime.infer.submit",
      "runtime.infer.started",
      "runtime.infer.completed"
    ]
  },
  "tasks": [
    {
      "task_id": "task-allowed",
      "session_id": "session-01",
      "state": "approved",
      "title": "Summarize the current plan locally",
      "created_at": "2026-03-13T12:58:00Z",
      "plan": {
        "task_id": "task-allowed"
      },
      "task_events": [
        {
          "event_id": "evt-01",
          "from_state": "planned",
          "to_state": "approved",
          "metadata": {
            "reason": "policy allowed"
          },
          "created_at": "2026-03-13T12:58:05Z"
        }
      ]
    }
  ],
  "working_memory": [
    {
      "ref_id": "wm-plan-task-allowed",
      "session_id": "session-01",
      "payload": {
        "task_id": "task-allowed",
        "summary": "plan summary"
      },
      "created_at": "2026-03-13T12:58:06Z"
    }
  ],
  "episodic_memory": [
    {
      "entry_id": "epi-01",
      "session_id": "session-01",
      "summary": "Created task task-allowed",
      "metadata": {
        "task_id": "task-allowed"
      },
      "created_at": "2026-03-13T12:58:07Z"
    }
  ],
  "audit_entries": [
    {
      "audit_id": "audit-01",
      "timestamp": "2026-03-13T12:58:01Z",
      "user_id": "user-01",
      "session_id": "session-01",
      "task_id": "task-allowed",
      "capability_id": "runtime.infer.submit",
      "decision": "allowed",
      "execution_location": "local",
      "route_state": "direct",
      "taint_summary": "none",
      "result": "ok"
    }
  ],
  "runtime_events": [
    {
      "event_id": "runtimed-evt-1",
      "timestamp": "2026-03-13T12:58:02Z",
      "source": "aios-runtimed",
      "kind": "runtime.infer.completed",
      "task_id": "task-allowed",
      "session_id": "session-01",
      "payload": {
        "backend_id": "local-cpu"
      }
    }
  ],
  "remote_audits": [],
  "observability_records": [
    {
      "observability_id": "obs-01",
      "timestamp": "2026-03-13T12:58:02Z",
      "source": "aios-runtimed",
      "kind": "runtime.infer.completed",
      "session_id": "session-01",
      "task_id": "task-allowed",
      "payload": {
        "backend_id": "local-cpu"
      }
    }
  ],
  "correlations": [
    {
      "task_id": "task-allowed",
      "audit_decisions": [
        "allowed"
      ],
      "runtime_event_kinds": [
        "runtime.infer.completed"
      ],
      "remote_audit_statuses": [],
      "observability_kinds": [
        "runtime.infer.completed"
      ],
      "state_transitions": [
        "planned->approved"
      ],
      "working_memory_refs": [
        "wm-plan-task-allowed"
      ],
      "episodic_summaries": [
        "Created task task-allowed"
      ],
      "approval_refs": []
    }
  ],
  "notes": [
    "cross-service correlation sample"
  ]
}
